{
  "schema_version": "2.0",
  "pilot_id": "replace-with-pilot-id",
  "study_stage": "feasibility",
  "plan_sha256": "0000000000000000000000000000000000000000000000000000000000000000",
  "assignment_sha256": "0000000000000000000000000000000000000000000000000000000000000000",
  "task_bank_sha256": "0000000000000000000000000000000000000000000000000000000000000000",
  "synthetic_example": false,
  "recorded_through": "2026-09-01",
  "participant_status": [
    {
      "participant_id": "P001",
      "sequence_id": "MAP",
      "consent_confirmed": true,
      "started": false,
      "final_status": "not_started",
      "periods_completed": 0,
      "reason_category": "none",
      "retain_pre_withdrawal_data_authorized": true
    }
  ],
  "work_item_roster": [
    {
      "participant_id": "P001",
      "work_item_id": "W001_P1_T01",
      "sequence_id": "MAP",
      "period": 1,
      "arm": "manual",
      "task_block_id": "B01",
      "task_id": "T01",
      "status": "planned",
      "intercurrent_event": "none",
      "missing_reason": "not_started",
      "human_effort_min": null,
      "elapsed_time_min": null,
      "rework_count": null,
      "quality_ratings": [],
      "material_error_count": null,
      "cognitive_burden_1_to_7": null,
      "would_adopt": null,
      "help_request_count": null,
      "facilitator_support_min": null,
      "approver_checker_min": null,
      "model_tool_cost_usd": null,
      "safety_events": [],
      "contamination_detected": null,
      "protocol_adherence": null
    }
  ]
}
